<?xml version="1.0" encoding="UTF-8" ?>
<Mascot xmlns="http://www.group-finity.com/Mascot" xmlns:xsi="http://www.w3.org/2001/XMLSchema-instance"
	xsi:schemaLocation="http://www.group-finity.com/Mascot Mascot.xsd">

	<ActionList>
		<Action Name="Look" Type="Embedded" Class="com.group_finity.mascot.action.Look" />
		<Action Name="Offset" Type="Embedded" Class="com.group_finity.mascot.action.Offset" />

		<!-- Standing -->

		<Action Name="Stand" Type="Stay" BorderType="Floor">
			<Animation>
				<Pose Image="/shime1.png" ImageAnchor="64,128" Velocity="0,0" Duration="150" />
				<Pose Image="/shime1a.png" ImageAnchor="64,128" Velocity="0,0" Duration="4" />
			</Animation>
		</Action>

		<Action Name="Walk" Type="Move" BorderType="Floor">
			<Animation>
				<Pose Image="/shime1.png" ImageAnchor="64,128" Velocity="-2,0" Duration="6" />
				<Pose Image="/shime2.png" ImageAnchor="64,128" Velocity="-2,0" Duration="6" />
				<Pose Image="/shime1.png" ImageAnchor="64,128" Velocity="-2,0" Duration="6" />
				<Pose Image="/shime3.png" ImageAnchor="64,128" Velocity="-2,0" Duration="6" />
			</Animation>
		</Action>

		<Action Name="Run" Type="Move" BorderType="Floor">
			<Animation>
				<Pose Image="/shime15.png" ImageAnchor="64,128" Velocity="-4,0" Duration="2" />
				<Pose Image="/shime16.png" ImageAnchor="64,128" Velocity="-4,0" Duration="2" />
				<Pose Image="/shime15.png" ImageAnchor="64,128" Velocity="-4,0" Duration="2" />
				<Pose Image="/shime17.png" ImageAnchor="64,128" Velocity="-4,0" Duration="2" />
			</Animation>
		</Action>

		<Action Name="Dash" Type="Move" BorderType="Floor">
			<Animation>
				<Pose Image="/shime1.png" ImageAnchor="64,128" Velocity="-8,0" Duration="2" />
				<Pose Image="/shime2.png" ImageAnchor="64,128" Velocity="-8,0" Duration="2" />
				<Pose Image="/shime1.png" ImageAnchor="64,128" Velocity="-8,0" Duration="2" />
				<Pose Image="/shime3.png" ImageAnchor="64,128" Velocity="-8,0" Duration="2" />
			</Animation>
		</Action>

		<!-- Sitting -->

		<Action Name="Sit" Type="Stay" BorderType="Floor">
			<Animation>
				<Pose Image="/shime11.png" ImageAnchor="64,128" Velocity="0,0" Duration="10" />
				<Pose Image="/shime11a.png" ImageAnchor="64,128" Velocity="0,0" Duration="4" />
				<Pose Image="/shime11b.png" ImageAnchor="64,128" Velocity="0,0" Duration="4" />
				<Pose Image="/shime11c.png" ImageAnchor="64,128" Velocity="0,0" Duration="4" />
				<Pose Image="/shime11b.png" ImageAnchor="64,128" Velocity="0,0" Duration="4" />
				<Pose Image="/shime11c.png" ImageAnchor="64,128" Velocity="0,0" Duration="4" />
				<Pose Image="/shime11b.png" ImageAnchor="64,128" Velocity="0,0" Duration="4" />
				<Pose Image="/shime11c.png" ImageAnchor="64,128" Velocity="0,0" Duration="4" />
				<Pose Image="/shime11b.png" ImageAnchor="64,128" Velocity="0,0" Duration="4" />
				<Pose Image="/shime11c.png" ImageAnchor="64,128" Velocity="0,0" Duration="4" />
				<Pose Image="/shime11b.png" ImageAnchor="64,128" Velocity="0,0" Duration="4" />
				<Pose Image="/shime11c.png" ImageAnchor="64,128" Velocity="0,0" Duration="4" />
				<Pose Image="/shime11b.png" ImageAnchor="64,128" Velocity="0,0" Duration="4" />
				<Pose Image="/shime11d.png" ImageAnchor="64,128" Velocity="0,0" Duration="4" />
				<Pose Image="/shime11.png" ImageAnchor="64,128" Velocity="0,0" Duration="4" />
			</Animation>
		</Action>
		<Action Name="SitAndLookUp" Type="Stay" BorderType="Floor">
			<Animation>
				<Pose Image="/shime26.png" ImageAnchor="64,128" Velocity="0,0" Duration="250" />
			</Animation>
		</Action>

		<Action Name="SitAndLookAtMouse" Type="Stay" BorderType="Floor">
			<Animation Condition="#{mascot.environment.cursor.y &lt; mascot.environment.screen.height/2}">
				<Pose Image="/shime26.png" ImageAnchor="64,128" Velocity="0,0" Duration="250" />
			</Animation>
			<Animation>
				<Pose Image="/shime11.png" ImageAnchor="64,128" Velocity="0,0" Duration="250" />
			</Animation>
		</Action>

		<Action Name="SitAndSpinHeadAction" Type="Animate" BorderType="Floor">
			<Animation>
				<Pose Image="/shime26.png" ImageAnchor="64,128" Velocity="0,0" Duration="5" />
				<Pose Image="/shime27.png" ImageAnchor="64,128" Velocity="0,0" Duration="5" />
				<Pose Image="/shime28.png" ImageAnchor="64,128" Velocity="0,0" Duration="5" />
				<Pose Image="/shime29.png" ImageAnchor="64,128" Velocity="0,0" Duration="5" />
			</Animation>
		</Action>

		<Action Name="SitWithLegsUp" Type="Stay" BorderType="Floor">
			<Animation>
				<Pose Image="/shime30.png" ImageAnchor="64,112" Velocity="0,0" Duration="4" />
				<Pose Image="/shime31.png" ImageAnchor="64,112" Velocity="0,0" Duration="4" />
			</Animation>
		</Action>

		<Action Name="SitWithLegsDown" Type="Stay" BorderType="Floor">
			<Animation>
				<Pose Image="/shime30.png" ImageAnchor="64,112" Velocity="0,0" Duration="4" />
				<Pose Image="/shime31.png" ImageAnchor="64,112" Velocity="0,0" Duration="4" />
			</Animation>
		</Action>

		<Action Name="SitAndDangleLegs" Type="Stay" BorderType="Floor">
			<Animation>
				<Pose Image="/shime30.png" ImageAnchor="64,112" Velocity="0,0" Duration="4" />
				<Pose Image="/shime31.png" ImageAnchor="64,112" Velocity="0,0" Duration="4" />
			</Animation>
		</Action>

		<!-- Laying -->

		<Action Name="Sprawl" Type="Stay" BorderType="Floor">
			<Animation>
				<Pose Image="/shime20.png" ImageAnchor="64,128" Velocity="0,0" Duration="40" />
				<Pose Image="/shime20a.png" ImageAnchor="64,128" Velocity="0,0" Duration="40" />
				<Pose Image="/shime20.png" ImageAnchor="64,128" Velocity="0,0" Duration="40" />
				<Pose Image="/shime20a.png" ImageAnchor="64,128" Velocity="0,0" Duration="40" />
				<Pose Image="/shime20.png" ImageAnchor="64,128" Velocity="0,0" Duration="40" />
				<Pose Image="/shime20a.png" ImageAnchor="64,128" Velocity="0,0" Duration="40" />
				<Pose Image="/shime20.png" ImageAnchor="64,128" Velocity="0,0" Duration="40" />
				<Pose Image="/shime20a.png" ImageAnchor="64,128" Velocity="0,0" Duration="40" />
				<Pose Image="/shime20b.png" ImageAnchor="64,128" Velocity="0,0" Duration="10" />
				<Pose Image="/shime21.png" ImageAnchor="64,128" Velocity="0,0" Duration="40" />
				<Pose Image="/shime21a.png" ImageAnchor="64,128" Velocity="0,0" Duration="40" />
				<Pose Image="/shime21.png" ImageAnchor="64,128" Velocity="0,0" Duration="40" />
				<Pose Image="/shime21a.png" ImageAnchor="64,128" Velocity="0,0" Duration="40" />
				<Pose Image="/shime20b.png" ImageAnchor="64,128" Velocity="0,0" Duration="10" />
				<Pose Image="/shime21.png" ImageAnchor="64,128" Velocity="0,0" Duration="40" />
				<Pose Image="/shime21a.png" ImageAnchor="64,128" Velocity="0,0" Duration="40" />
				<Pose Image="/shime21.png" ImageAnchor="64,128" Velocity="0,0" Duration="40" />
				<Pose Image="/shime21a.png" ImageAnchor="64,128" Velocity="0,0" Duration="40" />
				<Pose Image="/shime20b.png" ImageAnchor="64,128" Velocity="0,0" Duration="10" />
			</Animation>
		</Action>

		<Action Name="Creep" Type="Stay" BorderType="Floor">
			<Animation>
				<Pose Image="/shime20.png" ImageAnchor="64,128" Velocity="0,0" Duration="40" />
				<Pose Image="/shime20a.png" ImageAnchor="64,128" Velocity="0,0" Duration="40" />
				<Pose Image="/shime20.png" ImageAnchor="64,128" Velocity="0,0" Duration="40" />
				<Pose Image="/shime20a.png" ImageAnchor="64,128" Velocity="0,0" Duration="40" />
				<Pose Image="/shime20.png" ImageAnchor="64,128" Velocity="0,0" Duration="40" />
				<Pose Image="/shime20a.png" ImageAnchor="64,128" Velocity="0,0" Duration="40" />
				<Pose Image="/shime20.png" ImageAnchor="64,128" Velocity="0,0" Duration="40" />
				<Pose Image="/shime20a.png" ImageAnchor="64,128" Velocity="0,0" Duration="40" />
				<Pose Image="/shime20b.png" ImageAnchor="64,128" Velocity="0,0" Duration="10" />
				<Pose Image="/shime21.png" ImageAnchor="64,128" Velocity="0,0" Duration="40" />
				<Pose Image="/shime21a.png" ImageAnchor="64,128" Velocity="0,0" Duration="40" />
				<Pose Image="/shime21.png" ImageAnchor="64,128" Velocity="0,0" Duration="40" />
				<Pose Image="/shime21a.png" ImageAnchor="64,128" Velocity="0,0" Duration="40" />
				<Pose Image="/shime20b.png" ImageAnchor="64,128" Velocity="0,0" Duration="10" />
				<Pose Image="/shime21.png" ImageAnchor="64,128" Velocity="0,0" Duration="40" />
				<Pose Image="/shime21a.png" ImageAnchor="64,128" Velocity="0,0" Duration="40" />
				<Pose Image="/shime21.png" ImageAnchor="64,128" Velocity="0,0" Duration="40" />
				<Pose Image="/shime21a.png" ImageAnchor="64,128" Velocity="0,0" Duration="40" />
				<Pose Image="/shime20b.png" ImageAnchor="64,128" Velocity="0,0" Duration="10" />
			</Animation>
		</Action>

		<!-- Ceiling -->

		<Action Name="GrabCeiling" Type="Stay" BorderType="Ceiling">
			<Animation>
				<Pose Image="/shime23.png" ImageAnchor="64,48" Velocity="0,0" Duration="4" />
				<Pose Image="/shime23a.png" ImageAnchor="64,48" Velocity="0,0" Duration="4" />
				<Pose Image="/shime23.png" ImageAnchor="64,48" Velocity="0,0" Duration="4" />
				<Pose Image="/shime23a.png" ImageAnchor="64,48" Velocity="0,0" Duration="4" />
				<Pose Image="/shime23.png" ImageAnchor="64,48" Velocity="0,0" Duration="4" />
				<Pose Image="/shime23a.png" ImageAnchor="64,48" Velocity="0,0" Duration="4" />
				<Pose Image="/shime23.png" ImageAnchor="64,48" Velocity="0,0" Duration="4" />
				<Pose Image="/shime23a.png" ImageAnchor="64,48" Velocity="0,0" Duration="4" />
				<Pose Image="/shime23.png" ImageAnchor="64,48" Velocity="0,0" Duration="4" />
				<Pose Image="/shime23a.png" ImageAnchor="64,48" Velocity="0,0" Duration="4" />
				<Pose Image="/shime23.png" ImageAnchor="64,48" Velocity="0,0" Duration="4" />
				<Pose Image="/shime23a.png" ImageAnchor="64,48" Velocity="0,0" Duration="4" />
				<Pose Image="/shime23.png" ImageAnchor="64,48" Velocity="0,0" Duration="4" />